{
  "schema": "phoneManagedSettings",
  "schemaVersion": 1,
  "computerId": "computer-placeholder-01",
  "voiceRevision": "AAAAAAAAAAAAAAAAAAAAAAAAAAAAAAAAAAAAAAAAAAAAAAAAAAAAAAAAAAAAAAAA",
  "connectionRevision": "BBBBBBBBBBBBBBBBBBBBBBBBBBBBBBBBBBBBBBBBBBBBBBBBBBBBBBBBBBBBBBBB",
  "voice": {
    "activeEngine": "typeless",
    "shortcutOverrides": {
      "typeless": { "dictation": "CTRL+SHIFT+D" }
    }
  },
  "connection": {
    "usbWatchdog": true,
    "lanDiscovery": false,
    "autoStart": true
  }
}
